<?xml version="1.0" ?>
<!DOCTYPE PISI SYSTEM "http://www.uludag.org.tr/projeler/pisi/pisi-spec.dtd">

<PISI>
    <Source>
        <Name>a</Name>
        <Homepage>http://wiki.pisilinux.org/tr/index.php?title=PiSi_Hello_World</Homepage>
        <Packager>
            <Name>A. Murat Eren</Name>
            <Email>meren@uludag.org.tr</Email>
        </Packager>
        <License>As-Is</License>
        <PartOf>None</PartOf>
        <IsA>app:console</IsA>
        <Summary>PiSi Hello World Application..</Summary>
        <Summary xml:lang="tr">PiSi için merhaba dünya uygulaması, süper bir konsol uygulaması</Summary>
        <Description>Just a basic application. Nothing to describe.</Description>
        <Description xml:lang="tr">Sadece basit bir uygulama, açıklayacak bir şey yok</Description>
        <Archive sha1sum="fc917dec7b9729de935698f273f8007b2223653d" type="targz">http://cekirdek.uludag.org.tr/~meren/merhaba-pisi-1.0.tar.gz</Archive>
    </Source>

    <Package>
        <Name>a</Name>
        <Files>
            <Path fileType="executable">/usr/bin/</Path>
        </Files>
    </Package>


    <History>
        <Update release="1">
            <Date>2006-02-01</Date>
            <Version>1.0</Version>
            <Comment>First release.</Comment>
            <Name>A. Murat Eren</Name>
            <Email>meren@uludag.org.tr</Email>
        </Update>
    </History>
</PISI>
