<?xml version="1.0" encoding="utf-8" standalone="no"?>

<!DOCTYPE PISI SYSTEM "http://www.uludag.org.tr/projeler/pisi/pisi-spec.dtd">

<PISI>
    <Source>
        <Name>zip</Name>
        <Homepage>ftp://ftp.freesoftware.com/pub/infozip/Zip.html</Homepage>
        <Packager>
            <Name>PACKAGER</Name>
            <Email>PACKAGER_EMAIL</Email>
        </Packager>
        <License>Info-ZIP</License>
        <IsA>category</IsA>
        <PartOf>component</PartOf>
        <Summary xml:lang="en">Info ZIP (encryption support)</Summary>
        <Description xml:lang="en">Info ZIP (encryption support)</Description>
        <Archive type="targz" sha1sum="34ba126eb3344b0a35ee1a00fff9639994c7aba4">http://pkgs.fedoraproject.org/repo/pkgs/zip/zip231.tar.gz/6bfc076664416251d7624ab3538d1cb9/zip231.tar.gz</Archive>
        <Patches>
    		<!--Patch>zip-2.3-unix_configure-pic.patch</Patch> -->
    		<!-- <Patch level="1">zip-CAN-2004-1010.patch</Patch> -->
            <!-- <Patch level="1">zcrypt.patch</Patch> -->
        </Patches>
        <BuildDependencies>
            <Dependency>unzip</Dependency>
            <Dependency>patch</Dependency>
        </BuildDependencies>
    </Source>

    <Package>
        <Name>zip</Name>
        <RuntimeDependencies>
	    <Dependency>unzip</Dependency>
        </RuntimeDependencies>
        <Files>
            <Path fileType="binary">/usr/bin</Path>
            <Path fileType="doc">/usr/share/doc</Path>
            <Path fileType="doc">/usr/share/man</Path>
        </Files>
  </Package>

  <History>
    <Update release="3">
        <Date>2005-11-20</Date>
        <Version>2.31</Version>
    </Update>
     <Update release="2">
       <Date>2005-11-10</Date>
       <Version>2.31</Version>
     </Update>
  </History>

</PISI>

