<?xml version="1.0" encoding="utf-8" standalone="no"?>

<!DOCTYPE PISI SYSTEM "http://www.uludag.org.tr/projeler/pisi/pisi-spec.dtd">

<PISI>
    <Source>
        <Name>helloworld</Name>
        <Homepage>http://www.uludag.org.tr</Homepage>
        <Packager>
            <Name>S.Çağlar Onur</Name>
            <Email>caglar@uludag.org.tr</Email>
        </Packager>
        <License>GPL-2</License>
        <IsA>category</IsA>
        <PartOf>component</PartOf>
        <Summary xml:lang="en">Dummy HelloWorld for testing ActionsAPI</Summary>
        <Description xml:lang="en">Dummy HelloWorld for testing ActionsAPI</Description>
        <Archive type="tarbz2" sha1sum="3d7ee247c109d28db3437d2ce24f0e16f388d874">https://github.com/examachine/pisi/raw/master/tests/helloworld/helloworld-2.0.tar.bz2</Archive>
    </Source>

    <Package>
        <Name>helloworld</Name>
        <Files>
            <Path fileType="binary">/</Path>
        </Files>
  </Package>

          <History>
            <Update release="1">
                <Date>2005-08-21</Date>
                <Version>0.1</Version>
            </Update>
        </History>
</PISI>

